{
  "schema": "service-account-usage-scan-v1",
  "generatedAt": "2026-10-04T09:40:00.0000000+00:00",
  "tool": "Combined",
  "accounts": ["SYN\\svc_synapp"],
  "expectedAccount": null,
  "plannedServers": ["SYN-APP01", "SYN-APP02", "SYN-APP03", "SYN-APP04"],
  "results": [
    {
      "schema": "service-account-usage-v1",
      "serverName": "SYN-APP01",
      "generatedAt": "2026-10-04T09:15:00.0000000+00:00",
      "durationMs": 1840,
      "accounts": ["SYN\\svc_synapp"],
      "scanResult": "Success",
      "sources": { "WindowsServices": "Success", "ScheduledTasks": "Success", "Iis": "Success" },
      "components": [
        { "ComponentType": "IisAppPool", "ComponentName": "SynPool", "Identity": "SYN\\svc_synapp", "MatchedAccount": "SYN\\svc_synapp", "State": null, "Detail": null },
        { "ComponentType": "IisVirtualDirectory", "ComponentName": "SynSite/files", "Identity": "SYN\\svc_synapp", "MatchedAccount": "SYN\\svc_synapp", "State": null, "Detail": "\\\\syn-fs\\share" },
        { "ComponentType": "ScheduledTask", "ComponentName": "\\SynNightly", "Identity": "SYN\\svc_synapp", "MatchedAccount": "SYN\\svc_synapp", "State": "Ready", "Detail": "LogonType=Password" }
      ],
      "verification": null,
      "warnings": []
    },
    {
      "schema": "service-account-usage-v1",
      "serverName": "SYN-APP02",
      "generatedAt": "2026-10-04T09:16:10.0000000+00:00",
      "durationMs": 920,
      "accounts": ["SYN\\svc_synapp"],
      "scanResult": "Success",
      "sources": { "WindowsServices": "Success", "ScheduledTasks": "Success", "Iis": "NotInstalled" },
      "components": [],
      "verification": null,
      "warnings": []
    },
    {
      "schema": "service-account-usage-v1",
      "serverName": "SYN-APP03",
      "generatedAt": "2026-10-04T09:17:30.0000000+00:00",
      "durationMs": 1310,
      "accounts": ["SYN\\svc_synapp"],
      "scanResult": "Partial",
      "sources": { "WindowsServices": "Success", "ScheduledTasks": "Failed", "Iis": "Success" },
      "components": [],
      "verification": null,
      "warnings": ["ScheduledTasks: UnauthorizedAccessException"]
    }
  ],
  "notReached": [
    { "serverName": "SYN-APP04", "reason": "Unreachable" }
  ]
}
